2021;13/10/21;Lei, Philip I.S. and Mendes, António José;A systematic literature review on knowledge tracing in learning programming;higher education;36;6;Yes;Yes;No;Yes;"behavior data; demographic data; academic performance; knowledge";"(learning) behaviour data; interaction data; demographic & biographic data;  resource / assessment data;";"(learning) output data; (social) interaction data; master data; cognitive characteristics;";---;"- „Common models employed in the literature include probabilistic, statistical and artificial neural network models.“
- „[17], the authors formalized the knowledge model as a Fuzzy Cognitive Map of KCs, and defined fuzzy logic rules to update the knowledge levels in the student model“
- „Bayesian Knowledge Tracing (BKT)“
    => „using a Hidden Markov Model (HMM)“
    
- „Dynamic Bayesian Network (DBN)“
    
- „Additive Factor Model (AFM)“
    
- „stereotypes using demographics“
    
- „extension of AFM called Performance Factor Analysis [31]“
    
- „Deep Knowledge Tracing (DKT)“
    => „By treating knowledge tracing as a sequence prediction problem, Piech et al. [32] proposed Deep Knowledge Tracing and its two formulations (exercise-indexed and skill-indexed). Skill-indexed DKT employs Long Short-Term Memory (LSTM) recurrent neural networks [33] to predict whether a student can answer an exercise correctly based on the input sequence of the KCs covered and the correctness of answers in previous attempted exercises. As such, DKT builds a single model for all KCs, whereas BKT builds separate model for each KC.“";---;---;---;---;---;---;---;---;---;---
2021;08/09/21;Oeda, Shinichi and Shimizu, Daiki;Verification of Usefulness of Student Modeling with Real Educational Data using Convex Factorization Machines;not specified ;14;2;Yes;Yes;Yes;No;"learning items; skills; pre learing items; pre skills";"resource / assessment data;";"(learning) output data; cognitive characteristics;";---;---;"system; assessment;";"intelligent tutor system;";"assessment-based; automated collection;";"hybrid;";---;---;---;---;"predictive modeling;";consider time that has passed meanwhile (the longer the lower the expectations)
2021;17/08/21;Zhao, Xiangmei;Research on learner model of adaptive learning system;not specified ;5;3;Yes;Yes;No;No;"celts-11 learner model; basic information; learning behavior; personal information; demographic characteristics; learning style; cognitive level; academic emotion";"personal traits; (learning) behaviour data; demographic & biographic data;";"master data; (learning) output data; cognitive characteristics; affective & motivational characteristics;";---;---;"system;";"adaptive learning system;";"automated collection;";"implicit;



";"system;";"adaptive learning system;";"automated collection;";"implicit;";"overlay modeling; cognitive theories; clustering;";---
2021;06/08/21;Lwande, Charles and Muchemi, Lawrence and Oboko, Robert;Identifying learning styles and cognitive traits in a learning management system;higher education;41;85;Yes;Yes;No;No;"log data; learner behavior";"technical usage data; (learning) behaviour data;";"(system) environmental data; (learning) output data;";---;---;"system; assessment;";"learning management system / virtual learning environment;";"automated collection;";"implicit;



";---;---;---;---;"classification; predictive modeling;";---
2021;01/07/21;AL-Chalabi, Humam K. Majeed and Hussein, Aqueel M. Ali and Apoki, Ufuoma Chima;An Adaptive Learning System Based on Learner’s Knowledge Level;higher education;19;8;Yes;Yes;No;No;"knowledge level; experience; background; previous courses; educational performance; goals; interests";"academic / educational data; demographic & biographic data;  resource / assessment data; personal traits;";"cognitive characteristics; master data; (learning) output data;";---;---;"system; assessment;";"adaptive learning system;";"assessment-based; automated collection;";"hybrid;";"self-report; assessment;";---;"self-reporting; assessment-based;";"explicit;";"classification;";---
2021;18/06/21;Wang, Shu and Yuan, Linyun and Yang, Hongzhi;User Model Construction of Chinese Learners Based on Learning Style;school;12;2;Yes;Yes;Yes;No;"cognitive level; learning style; Basic information; Knowledge level; behavior";"personal traits; (learning) behaviour data;";"cognitive characteristics; master data; (learning) output data;";---;- „fuzzy sets“;"system; assessment;";"personalized learning environment / recommender system;";"automated collection; assessment-based;";"hybrid;";"self-report; assessment; system;";"personalized learning environment / recommender system;";"self-reporting; automated collection;";"hybrid;";---;mastery is 0 can mean not learned or forgotten
2021;12/04/21;Abdi, Solmaz and Khosravi, Hassan and Sadiq, Shazia;Modelling Learners in Adaptive Educational Systems: A Multivariate Glicko-Based Approach;not specified ;29;13;Yes;Yes;Yes;No;knowledge;---;"cognitive characteristics;";---;- overlay model;"system; assessment;";"adaptive learning system;";"assessment-based; automated collection;";"hybrid;";"system;";"adaptive learning system;";"automated collection;";"implicit;";"overlay modeling; predictive modeling;";considers lag time modelled as confidence parameter
2021;05/03/21;Li, Xiaoying and He, Shouwu;Research and Analysis of Student Portrait Based on Campus Big Data;higher education;10;11;Yes;Yes;No;No;"behavior data; basic information; learning ability; consumption level; daily habits; interest preference; curriculum information";"(learning) behaviour data; interaction data; personal traits; academic / educational data;  resource / assessment data;";"(learning) output data; (social) interaction data; master data; cognitive characteristics;";---;---;"system; external source; assessment;";"other;";"third-party reporting;";"implicit;



";---;---;---;---;"clustering;";---
2021;03/02/21;Miraz, Mahdi H. and Ali, Maaruf and Excell, Peter S.;Adaptive user interfaces and universal usability through plasticity of user interface design;not specified ;172;98;Yes;Yes;No;Yes;"Personality Traits; Vocational Interests; Perceptual Style; Vocational Aptitude; Computer Experience and Application Experience; Psychological; Physical Human Characteristics; Cognitive Human Characteristics; users’ background; goals; competency; cultural-linguistic heritage; cognitive behaviour";"personal traits; academic / educational data; physiological data; psychomotor data; demographic & biographic data;";"master data; cognitive characteristics; psychomotor & physiological data;";---;---;---;---;---;---;---;---;---;---;---;---
2020;29/12/20;Vo, Duc-Vinh and Karnjana, Jessada and Huynh, Van-Nam;An integrated framework of learning and evidential reasoning for user profiling using short texts;not specified ;68;12;Yes;Yes;No;No;"knowledge; demographic traits; geographical location; user intentions";"demographic & biographic data; contextual data;";"cognitive characteristics; master data; (system) environmental data; affective & motivational characteristics;";---;---;---;---;---;---;"external source; system;";"social media;";"automated collection; third-party reporting;";"implicit;";"clustering; predictive modeling; uncertainty modeling; ";---
2020;15/12/20;Chrysafiadi, Konstantina and Troussas, Christos and Virvou, Maria;Combination of fuzzy and cognitive theories for adaptive e-assessment;higher education;37;30;Yes;Yes;No;No;"age; knowledge level; error categories";"demographic & biographic data; (learning) behaviour data;";"master data; cognitive characteristics; (learning) output data;";---;- „fuzzy sets“;"system; assessment;";"adaptive learning system;";"automated collection;";"implicit;



";"self-report; third party;";---;---;---;"uncertainty modeling; cognitive theories;";---
2020;03/12/20;Jing, Sifeng and Tang, Ying and Liu, Xiwei and Gong, Xiaoyan;A Learner Model Integrating Cognitive and Metacognitive And Its Application on Scratch Programming Projects;school;28;22;Yes;Yes;No;No;"knowledge level; assessment data; log files; data of learner learning video; learner attention detection";"resource / assessment data; technical usage data; (learning) behaviour data;";"cognitive characteristics; (learning) output data; (system) environmental data;";---;---;"system; sensors & wearables; assessment; observation source;";"other;";"automated collection; observation; assessment-based;";"hybrid;";---;---;---;---;"cognitive theories; predictive modeling;";---
2020;30/10/20;Jing, Sifeng and Tang, Ying and Liu, Xiwei and Gong, Xiaoyan and Cui, Wei and Liang, Joleen;A Parallel Education Based Intelligent Tutoring Systems Framework;not specified ;73;6;No;Yes;No;No;---;---;---;---;---;"system; external source;";"intelligent tutor system; other;";"automated collection; third-party reporting;";"implicit;



";---;---;---;---;---;---
2020;24/10/20;Luxing, Lin;Student Aesthetic Education Recommendation App Based on Interest;school;5;1;Yes;Yes;No;No;"Basic Information; Knowledge; Usertype";"personal traits; identification data;";"master data; cognitive characteristics;";---;---;"system;";"personalized learning environment / recommender system;";"automated collection;";"implicit;



";---;---;---;---;"predictive modeling; classification;";---
2020;11/10/20;Tang, Qing and Abel, Marie-Hélène and Negre, Elsa;Towards the Privacy-Preserving of Online Recommender System in Collaborative Learning Environment;not specified ;28;0;Yes;Yes;No;No;"learner’s degree; language level; learner’s basic knowledge level; learner’s contribution; learner’s credibility; learner’s competency";"academic / educational data; demographic & biographic data; social content data;";"master data; cognitive characteristics; (social) interaction data;";---;---;"system;";"collaborative learning environment;";"automated collection;";"implicit;



";---;---;---;---;"predictive modeling; clustering;";---
2020;01/10/20;Cully, Antoine and Demiris, Yiannis;Online Knowledge Level Tracking with Data-Driven Student Models and Collaborative Filtering;school;62;22;No;Yes;No;No;---;---;---;---;---;"system; assessment;";"intelligent tutor system;";"automated collection; assessment-based;";"hybrid;";---;---;---;---;"predictive modeling; uncertainty modeling;";---
2020;18/08/20;Qiu, Wen and Du, Jing and Li, Fei;Knowledge Description Frame of Learning Resources for Recommendation System: From the Perspectives of Learning Psychology;school;5;2;Yes;No;No;No;"academic information; management; relations; security; preference; performance; portfolio; background; region; ways of learning; language skills; health conditions; phase of studying; learning plan; certificates of completion; roles of relations; preferred media";"academic / educational data; identification data; interaction data; personal traits;  resource / assessment data; demographic & biographic data; contextual data;";"master data; (social) interaction data; (learning) output data; (system) environmental data; cognitive characteristics;";---;---;---;---;---;---;---;---;---;---;---;---
2020;12/08/20;Schulz, Sandra and Lingnau, Andreas;An Evidence-Based Learner Model for Supporting Activities in Robotics;school;15;2;Yes;Yes;No;No;"(self-)assessment data; formal assessment results; knowledge; log data";"resource / assessment data; technical usage data;";"metacognitive characteristics; (learning) output data; cognitive characteristics; (system) environmental data;";---;---;"system; observation source; sensors & wearables; assessment; third party;";"other;";"automated collection; assessment-based; third-party reporting;";"hybrid;";"assessment; third party; self-report;";---;"self-reporting; assessment-based; third-party reporting;";"hybrid;";---;---
2020;24/07/20;Rowe, Jonathan P. and Lester, James C.;Artificial Intelligence for Personalized Preventive Adolescent Healthcare;school;40;50;Yes;Yes;No;No;occurrences of negative, deactivating emotions;"(learning) behaviour data;";"(learning) output data;";---;---;---;---;---;---;---;---;---;---;---;---
2020;13/07/20;Ramírez Luelmo, Sergio Iván and El Mawas, Nour and Heutte, Jean;Towards Open Learner Models Including the Flow State;lifelong learning;43;6;Yes;Yes;No;No;"learner’s psychological state; learner’s progress; knowledge";"physiological data; (learning) behaviour data;";"psychomotor & physiological data; (learning) output data; cognitive characteristics;";---;- Generic Bayesian Student Model (GBSM);"self-report; system;";"massive open online course;";"self-reporting; automated collection;";"hybrid;";"self-report;";---;"self-reporting;";"explicit;";"uncertainty modeling; cognitive theories;";---
2020;11/05/20;Hooshyar, Danial and Pedaste, Margus and Saks, Katrin and Leijen, Äli and Bardone, Emanuele and Wang, Minhong;Open learner models in supporting self-regulated learning in higher education: A systematic literature review;higher education;82;141;Yes;Yes;No;Yes;"cognition; metacognition; motivation; emotion;";---;"cognitive characteristics; metacognitive characteristics; affective & motivational characteristics;";---;---;---;---;---;---;---;---;---;---;---;---
2020;01/04/20;Bull, Susan;There are Open Learner Models About!;not specified ;171;84;Yes;Yes;Yes;Yes;"current level; skills; competencies; understanding of concepts; conceptual relationships; misconceptions; motivation; engagement; effort; affective state; learning style; metacognitive skills; collaboration; helpfulness; knowledge level";"academic / educational data; (learning) behaviour data; personal traits; interaction data;";"master data; cognitive characteristics; (learning) output data; affective & motivational characteristics; metacognitive characteristics; (social) interaction data;";---;---;---;---;---;---;---;---;---;---;---;often direct contribution from users, e. g. when it's about forgetting
2020;23/03/20;Faucon, Louis and Olsen, Jennifer K. and Dillenbourg, Pierre;A Bayesian Model of Individual Differences and Flexibility in Inductive Reasoning for Categorization of Examples;school;37;4;Yes;Yes;No;No;"students’ individual biases; generalization of biases across topics and changes of biases; real-time knowledge tracing";"academic / educational data;  resource / assessment data;";"master data; (learning) output data; cognitive characteristics;";---;- BKT [7];"system; assessment;";"adaptive learning system;";"automated collection; assessment-based;";"implicit;



";"system;";"adaptive learning system;";"automated collection;";"implicit;";"uncertainty modeling; predictive modeling;";---
2020;07/02/20;Tacoma, Sietske and Geurts, Corine and Slof, Bert and Jeuring, Johan and Drijvers, Paul;Enhancing learning with inspectable student models: Worth the effort?;higher education;47;11;Yes;Yes;No;No;list of homework set;"resource / assessment data;";"(learning) output data;";---;---;"system; assessment;";"learning management system / virtual learning environment;";"automated collection; assessment-based;";"hybrid;";---;---;---;---;---;---
2019;10/12/19;Taufik, Rahman and Nurjanah, Dade;An Intelligent Tutoring System with Adaptive Exercises Based on a Student’s Knowledge and Misconception;not specified ;13;1;Yes;No;No;No;"knowledge; skills; learning styles; ability to solve problems; misconceptions; interests; goals; background; individual traits; context; learning history";"personal traits; (learning) behaviour data; academic / educational data; demographic & biographic data; contextual data; technical usage data;";"cognitive characteristics; master data; (learning) output data; (system) environmental data;";---;---;---;---;---;---;---;---;---;---;---;---
2019;06/12/19;Yuan, Xinrui and Yang, Cheng;Attention-Based User Temporal Model for Recommendation;not specified ;15;1;Yes;No;No;No;attention;---;"cognitive characteristics;";---;- RNN network ;---;---;---;---;---;---;---;---;---;---
2019;24/09/19;Al-Shabandar, Raghad and Hussain, Abir Jaafar and Liatsis, Panos and Keight, Robert;Detecting At-Risk Students With Early Interventions Using Machine Learning Techniques;higher education;52;41;Yes;Yes;No;No;"course activities; learner historical behaviour; amotivation; grade; learning achievement; behavioural features";"academic / educational data;  resource / assessment data; (learning) behaviour data;";"master data; (learning) output data; affective & motivational characteristics;";---;---;"system; assessment;";"massive open online course;";"assessment-based; automated collection;";"hybrid;";---;---;---;---;"predictive modeling;";---
2019;15/08/19;Zhang, Xiaotong and Cheng, Hercy N. H.;Mining the Patterns of Graduate Students' Self-Regulated Learning Behaviors in a Negotiated Online Academic Reading Assessment;higher education;17;6;No;Yes;Yes;No;---;---;---;---;---;"self-report; assessment; system;";"adaptive learning system;";"automated collection; assessment-based; self-reporting;";"hybrid;";"assessment; self-report;";---;"automated collection; assessment-based;";"hybrid;";"predictive modeling;";---
2019;23/07/19;Saurabh, Roy and Singh, Nandini C. and Duraiappah, Anantha K.;The Alternate Education for the 21st Century;not specified ;32;1;Yes;Yes;No;No;"User’s metadata; user preferences; goal; needs; interests; user ontology; user’s engagement; Behaviour; Accessibility; Activity; Competency; Qualification; Relationship; User adaptive Interactions";"identification data; personal traits; demographic & biographic data; (learning) behaviour data; academic / educational data; interaction data;";"master data; (learning) output data; affective & motivational characteristics; cognitive characteristics; (social) interaction data;";---;---;"self-report; system;";"other;";"self-reporting; automated collection;";"hybrid;";"self-report;";---;"self-reporting;";"explicit;";"ontology; uncertainty modeling;";---
2019;06/06/19;Schmidmaier, Matthias and Han, Zhiwei and Weber, Thomas and Liu, Yuanting and Hußmann, Heinrich;Real-Time Personalization in Adaptive IDEs;not specified ;17;4;Yes;Yes;No;No;"user interaction; prior knowledge";"interaction data;";"(social) interaction data; cognitive characteristics;";---;---;"system;";"adaptive learning system;";"automated collection;";"implicit;



";---;---;---;---;"predictive modeling; classification;";---
2019;08/05/19;Ochukut, Selina A. and Oboko, Robert;A Learner Model for Adaptive e-Leaning Based on Learning Theories;not specified ;32;5;Yes;No;No;Yes;"portfolio; preference; results; learning style; psychological experience; flow experience; errors; misconceptions; skills; knowledge; cognitive factors; metacognitive factors; affective states; Learner preferences; personal characteristics; emotional traits; personality traits; difficulties; demographic data; time; device; task; location; social context; basic information";"resource / assessment data; personal traits; academic / educational data; (learning) behaviour data; demographic & biographic data; contextual data;";"(learning) output data; master data; affective & motivational characteristics; cognitive characteristics; metacognitive characteristics; (system) environmental data;";---;---;---;---;---;---;---;---;---;---;---;---
2019;03/04/19;Ahmadaliev, Doniyorbek and Xiaohui, Chen and Abduvohidov, Murodjon and Medatov, Asilbek and Temirova, Gulbahor;An adaptive activity sequencing instrument to enhance e-learning: an integrated application of overlay user model and mathematical programming on the Web;not specified ;14;5;No;Yes;No;No;---;---;---;---;---;"system; assessment;";"adaptive learning system;";"automated collection; assessment-based;";"hybrid;";"self-report;";---;"self-reporting;";"explicit;";"overlay modeling;";---
2019;27/03/19;Ennouamani, Soukaina and Mahani, Zouhir;A Comparative Study of the Learner Model in Adaptive Mobile Learning Systems;not specified ;24;4;Yes;Yes;No;Yes;"learning styles; knowledge level; interactions; preferences; learning progress; academic information; personal information; interests; learning objectives; mobile sensors; location; time; learner’s motions; physical activities; screen size; battery level;  multimedia capacities; storage capacities; network signal; destination; current location; the nearest learning target; time needed for each task; learning path; proposed solution; context-aware location; background; concentration level; behavior; mobility needs; foreign language level; learning style; activities; demographics; cognitive styles; goals; learner experiences; skills; learning actions; behaviors; motivation; attitudes; social collaborations; performance; domain expertise; learning activity; Satisfaction; Noise";"personal traits; interaction data; (learning) behaviour data; academic / educational data; demographic & biographic data;  resource / assessment data; contextual data; psychomotor data; social content data;";"master data; cognitive characteristics; (social) interaction data; (learning) output data; (system) environmental data; psychomotor & physiological data; affective & motivational characteristics;";---;---;---;---;---;---;---;---;---;---;---;---
2019;26/03/19;David, Joe and Lobov, Andrei and Lanz, Minna;Attaining Learning Objectives by Ontological Reasoning using Digital Twins;not specified ;8;23;Yes;Yes;No;No;"user behaviour; mouse-tracking; eye-tracking; behaviour";"(learning) behaviour data; interaction data; physiological data; technical usage data;";"(learning) output data; (social) interaction data; psychomotor & physiological data; (system) environmental data;";---;---;"system;";"other;";"automated collection; observation;";"implicit;



";---;---;---;---;"ontology;";---
2018;24/12/18;Afini Normadhi, Nur Baiti and Shuib, Liyana and Md Nasir, Hairul Nizam and Bimba, Andrew and Idris, Norisma and Balakrishnan, Vimala;Identification of personal traits in adaptive learning environment: Systematic literature review;not specified ;120;193;Yes;Yes;No;Yes;"learning styles; cognitive styles; prior knowledge; working memory capacity; thinking process; personality type; affective; emotions; mental state; engagement; Behavior; Psychomotor; cognitive abilities; performance";"personal traits; (learning) behaviour data; psychomotor data;  resource / assessment data;";"master data; cognitive characteristics; affective & motivational characteristics; (learning) output data; psychomotor & physiological data;";Cognition, Affective, Behavior / Psychomotor, MIXED;---;---;---;---;---;---;---;---;---;---;---
2018;17/11/18;Minn, Sein and Yu, Yi and Desmarais, Michel C. and Zhu, Feida and Vie, Jill-Jênn;Deep Knowledge Tracing and Dynamic Student Classification for Knowledge Tracing;not specified ;23;15;Yes;Yes;No;No;Knowledge;---;"cognitive characteristics;";---;- RNN;---;---;---;---;---;---;---;---;---;---
2018;17/11/18;Minn, Sein and Zhu, Feida and Desmarais, Michel C.;Improving Knowledge Tracing Model by Integrating Problem Difficulty;not specified ;12;21;Yes;No;No;No;"knowledge; learning behaviour";"(learning) behaviour data;";"cognitive characteristics; (learning) output data;";---;---;---;---;---;---;---;---;---;---;---;---
2018;28/10/18;Martins, Gonçalo S. and Santos, Luís and Dias, Jorge;BUM: Bayesian User Model for Distributed Learning of User Characteristics From Heterogeneous Information;not specified ;26;7;Yes;Yes;No;No;user characteristics;"personal traits; demographic & biographic data;";"master data;";---;"- BKT
- A-Posteriori";"sensors & wearables; observation source; external source; system;";"other; adaptive learning system;";"automated collection; observation; third-party reporting;";"implicit;



";"system;";"other; adaptive learning system;";"automated collection;";"implicit;";"uncertainty modeling; predictive modeling;";---
2018;24/10/18;Abyaa, Abir and Idrissi, Mohammed Khalidi and Bennani, Samir;Predicting the Learner's Personality from Educational Data Using Supervised Learning;not specified ;13;13;Yes;Yes;No;No;personality;"personal traits;";"master data;";---;---;"external source;";---;"automated collection; third-party reporting;";"implicit;



";---;---;---;---;"classification; predictive modeling;";---
2018;15/10/18;Zhao, Yang and Fan, Yaqing and Wang, Peng;Research on Student Model Construction of Educational Big Data System Based on CD-CAT;not specified ;14;0;Yes;Yes;No;No;"basic information, knowledge status; course; learning behaviour; cognitive level";"personal traits;";"master data;";---;---;"system; assessment;";"other;";"automated collection; assessment-based;";"hybrid;";"self-report;";---;"automated collection;";"explicit;";"cognitive theories; predictive modeling;";---
2018;10/10/18;Raj, Nisha S. and Renumol, V. G.;Architecture of an Adaptive Personalized Learning Environment (APLE) for Content Recommendation;not specified ;27;19;Yes;Yes;No;No;"learning style; media preference; learner's level of knowledge; context of learning";"personal traits; contextual data;";"master data; cognitive characteristics; (system) environmental data;";---;- DBN;"system;";"adaptive learning system; personalized learning environment / recommender system;";"automated collection;";"implicit;



";"self-report; assessment;";---;"self-reporting;";"explicit;";"ontology; uncertainty modeling; predictive modeling;";---
2018;03/10/18;Almeida, Thais Oliveira and de M. Netto, José Francisco;Adaptation Content in Robotic Systems: A Systematic Mapping Study;higher education;30;1;Yes;Yes;No;Yes;"student interaction; students' knowledge; cognitive profile; learning style";"interaction data; personal traits;";"(social) interaction data; cognitive characteristics; master data;";---;- (D)BN;---;---;---;---;---;---;---;---;---;---
