2018;27/07/18;Alday, Roselie B.;Bayesian Networks in Intelligent Tutoring Systems as an Assessment of Student Performance Using Student Modeling;not specified ;9;4;Yes;Yes;Yes;No;---;---;---;---;- (D)BN;"system; assessment;";"intelligent tutor system;";"assessment-based;";"explicit;";"system; assessment;";"intelligent tutor system;";"assessment-based; automated collection;";"hybrid;";"uncertainty modeling;";---
2018;23/07/18;Papadimitriou, Spyros and Chrysafiadi, Konstantina and Kamitsios, Margaritis and Virvou, Maria;FSP Creator: A Novel Web Service API Creator of Fuzzy Students Progress Profile;not specified ;17;3;Yes;Yes;Yes;No;"level of knowledge; performance history";"(learning) behaviour data;";"cognitive characteristics; (learning) output data;";---;---;"assessment;";---;"assessment-based; automated collection;";"explicit;";---;---;---;---;"uncertainty modeling; ";---
2018;09/07/18;Qiao, Chen and Hu, Xiao;Discovering Student Behavior Patterns from Event Logs: Preliminary Results on a Novel Probabilistic Latent Variable Model;higher education;18;10;Yes;Yes;No;No;"events; learner-resource interactions";"technical usage data; interaction data;";"(system) environmental data; (social) interaction data;";---;- Hidden Behavior Traits Model;"system; ";"learning management system / virtual learning environment;";"automated collection;";"implicit;



";---;---;---;---;"clustering; predictive modeling; ";---
2018;03/07/18;Barria-Pineda, Jordan and Guerra-Hollstein, Julio and Brusilovsky, Peter;A Fine-Grained Open Learner Model for an Introductory Programming Course;higher education;25;20;Yes;No;No;No;"student behavior in the system; student knowledge";"(learning) behaviour data; interaction data;";"(learning) output data; (social) interaction data; cognitive characteristics;";---;---;---;---;---;---;---;---;---;---;---;---
2018;03/07/18;Emerson, Andrew and Sawyer, Robert and Azevedo, Roger and Lester, James;Gaze-Enhanced Student Modeling for Game-Based Learning;higher education;47;21;Yes;Yes;No;No;eye-tracking;"physiological data;";"psychomotor & physiological data;";---;---;"system;";"game-based system;";"automated collection;";"implicit;



";"assessment; self-report;";---;"assessment-based; self-reporting;";"explicit;";"predictive modeling;";---
2018;27/06/18;Jun-min, Ye and Song, Xu and Da-Xiong, Luo and Zhi-Feng, Wang and Peng-Wei, Huang and Chen, Xu;Research on the Construction and Application of Individual Learner Model;not specified ;7;4;Yes;No;No;No;"personal profile; health file; hobby; academic achievment; study plan; award certification; e-learning progress; learning style; cognitive ability";"personal traits; demographic & biographic data; academic / educational data; (learning) behaviour data;  resource / assessment data;";"master data; (learning) output data; cognitive characteristics;";---;---;---;---;---;---;---;---;---;---;---;---
2018;27/06/18;Lu, Haokai and Niu, Wei and Caverlee, James;Learning Geo-Social User Topical Profiles with Bayesian Hierarchical User Factorization;not specified ;40;4;Yes;Yes;No;No;"User’s Geo-Topic location; social ties";"contextual data; social content data;";"(system) environmental data; (social) interaction data;";---;- Bayesian Poisson Tensor Factorization (BPTF);"third party;";---;"third-party reporting;";"implicit;



";---;---;---;---;"uncertainty modeling; predictive modeling;";---
2018;04/06/18;Yago, Hector and Clemente, Julia and Rodriguez, Daniel and Fernandez-de-Cordoba, Pedro;ON-SMMILE: Ontology Network-based Student Model for MultIple Learning Environments;not specified ;60;39;Yes;Yes;No;No;"knowledge; activities; learning progress; learning style";"(learning) behaviour data; personal traits;";"cognitive characteristics; (learning) output data; master data;";---;- modular ontology network;"assessment; system;";"personalized learning environment / recommender system;";---;---;---;---;---;---;"ontology;";---
2018;08/05/18;Yang, Fan and Li, Frederick W. B.;Study on student performance estimation, student progress analysis, and student potential prediction based on data mining;higher education;32;216;Yes;No;No;No;"learning styles; Konwledge; Attitude; Skill";"personal traits;";"master data; cognitive characteristics;";---;---;---;---;---;---;---;---;---;---;---;---
2018;27/04/18;Ding, Wenling and Zhu, Zhengzhou and Guo, Qun;A New Learner Model in Adaptive Learning System;higher education;19;14;Yes;Yes;No;No;"basic infomration; Nation; Grade; learning style; knowledge state; cognitive ability";"demographic & biographic data; identification data; academic / educational data; personal traits;";"master data; cognitive characteristics;";---;---;"system; assessment;";"intelligent tutor system;";"assessment-based; automated collection;";"hybrid;";"self-report;";---;"self-reporting;";"explicit;";"classification; predictive modeling;";---
2018;26/04/18;Beyyoudh, Mohammed and Idrissi, Mohammed Khalidi and Bennani, Samir;A new approach of designing an intelligent tutoring system based on adaptive workflows and pedagogical games;not specified ;23;8;Yes;Yes;No;No;"personal information; learner skills; learner preferences; interactions with system; general knowledge";"demographic & biographic data; personal traits; interaction data;";"master data; cognitive characteristics; (social) interaction data;";---;- Overlay Model;"system; assessment;";"intelligent tutor system;";"automated collection; assessment-based;";"hybrid;";"self-report;";---;"self-reporting;";"explicit;";"predictive modeling; overlay modeling;";---
2018;17/04/18;Akharraz, Laila and El Mezouary, Ali and Mahani, Zouhir;To context-aware learner modeling based on ontology;not specified ;42;15;Yes;No;No;No;"personal data; identification; general information; learning style; objectives; preferences; interests; cognitive characteristics; background; language skills;  technical skills; Activity data; evaluation log; outcomes; errors; satisfaction; contextual data; device; connectivity; learner's accessibility; location; social interaction; learner's behaviors";"demographic & biographic data; identification data; personal traits; academic / educational data;  resource / assessment data; technical usage data; (learning) behaviour data; contextual data; interaction data;";"master data; cognitive characteristics; (learning) output data; (system) environmental data; affective & motivational characteristics; (social) interaction data;";---;---;---;---;---;---;---;---;---;---;---;---
2018;17/04/18;Nurjanah, Dade;LifeOn, a ubiquitous lifelong learner model ontology supporting adaptive learning;not specified ;15;13;Yes;No;No;No;"Personal identity; disability; Aptitude; Language preference; Learning approach; Learning style; Personality; Cognitive capability; History; Stereotypes; User Objectives; Goals; knowledge; prerequisites; experience; preferences; user interest";"identification data; personal traits; academic / educational data; demographic & biographic data; technical usage data; (learning) behaviour data;";"master data; cognitive characteristics; (system) environmental data; (learning) output data;";static, dynamic;- ontology;---;---;---;---;---;---;---;---;---;---
2018;10/03/18;Aissaoui, Ouafae {EL;Combining supervised and unsupervised machine learning algorithms to predict the learners’ learning styles;not specified ;21;99;Yes;No;No;No;"learning style; learners' behaviors";"personal traits; (learning) behaviour data; interaction data;";"master data; (learning) output data; (social) interaction data;";---;- naive Bayes classifier;---;---;---;---;---;---;---;---;---;---
2018;00.03.2018;Sun, Geng and Cui, Tingru and Yong, Jianming and Shen, Jun and Chen, Shiping;MLaaS: A Cloud-Based System for Delivering Adaptive Micro Learning in Mobile MOOC Learning;not specified ;58;95;Yes;Yes;No;No;"Basic information; Personal Non-Intelligent Factors; Personal Intelligent Factors; learning preference; learning engegementz; motivation; learning purpose; learner type; time availability; skills; learning speed, habits, degree of distraction, learning location, environment; knowledge; learning styles; memory ability; collaborative learning";"personal traits; academic / educational data; (learning) behaviour data;";"master data; cognitive characteristics; affective & motivational characteristics; (learning) output data;";---;---;"system;";"learning management system / virtual learning environment;";"automated collection;";"implicit;



";"assessment; external source; system; ";"learning management system / virtual learning environment;";"automated collection;";"implicit;";"clustering; predictive modeling;";---
2018;15/02/18;Kavitha, P. and Krishna Moorthy, B. and Sudharshan, P.S and Aarthi, T;Mapping Artificial Intelligence and Education;not specified ;7;8;Yes;Yes;Yes;No;"responses to questions; response time; time consumed while consulting help; concentrating to the concept";"(learning) behaviour data; interaction data; technical usage data;";"(learning) output data; (social) interaction data; (system) environmental data; cognitive characteristics;";"- General Information
- Kowledge
- Preferences
-  Cgn. & phy. Capacities";- Bayesian Network (BN);"system; assessment;";"adaptive learning system;";"automated collection;";"implicit;



";"self-report; third party; ";---;---;---;"clustering; uncertainty modeling; predictive modeling;";---
2017;25/12/17;Fei Zhou, Tong and Qing Pan, Yu and Huang, Li Rong;Research on Personalized E-Learning Based on Decision Tree and RETE Algorithm;not specified ;11;7;Yes;Yes;No;No;"historical learning database; access logs; knowledge path information; test scores; information database; personal information; learning style;, learning behavior; academic information; preference information; performance information";"(learning) behaviour data; academic / educational data; technical usage data;  resource / assessment data; demographic & biographic data; interaction data; personal traits;";"(learning) output data; master data; (system) environmental data; cognitive characteristics; (social) interaction data;";---;---;"system; external source; assessment;";"personalized learning environment / recommender system;";"automated collection; assessment-based; third-party reporting;";"hybrid;";---;---;---;---;"classification; clustering;";---
2017;18/12/17;Janati, Salma El and Maach, Abdelilah and Ghanami, Driss El;SMART Education Framework for Adaptation Content Presentation;not specified ;34;51;No;Yes;Yes;No;---;---;---;---;---;"system; assessment;";"adaptive learning system;";"automated collection; assessment-based;";"hybrid;";"self-report; system;";"adaptive learning system;";"automated collection; self-reporting;";"hybrid;";"predictive modeling; uncertainty modeling;";---
2017;29/10/17;Al-Abri, Amal and Al-Khanjari, Zuhoor and Kraiem, Naoufel and Jamoussi, Yassine;A scheme for extracting information from collaborative social interaction tools for personalized educational environments;not specified ;28;8;No;Yes;No;No;---;---;---;---;---;"system; assessment;";"learning management system / virtual learning environment; social media;";"automated collection;";"implicit;";---;---;---;---;"predictive modeling; clustering;";---
2017;25/10/17;Abyaa, Abir and Idrissi, Mohammed Khalidi and Bennani, Samir;An Adult Learner's Knowledge Model Based on Ontologies and Rule Reasoning;adult learning;25;9;Yes;Yes;Yes;No;"knowledge; experiences; misconceptions; errors; forgotten knowledge";"academic / educational data; (learning) behaviour data;";"cognitive characteristics; master data; (learning) output data;";---;"- ontology
-  combination of fuzzy logic, fuzzy rules, overlay model and stereotypes";"assessment; self-report;";---;"self-reporting; automated collection; assessment-based;";"hybrid;";"assessment; self-report;";---;"self-reporting; assessment-based;";"explicit;";"ontology; perturbation modeling;";"taxonomy: ""periodic quizzes and acquired knowledge reviews through space repetition algorithms (SR)"""
2017;05/10/17;Ferreira, Hiran Nonato M. and Araújo, Rafael Dias and Dorça, Fabiano Azevedo and Cattelan, Renan G.;Open student modeling for academic performance visualization in Ubiquitous Learning Environments;higher education;36;9;Yes;Yes;No;No;"knowledge; behavior";"resource / assessment data; technical usage data; (learning) behaviour data;";"(learning) output data; (system) environmental data;";---;---;"system; assessment;";"ubiquitous learning environment;";"assessment-based; automated collection;";"hybrid;";---;---;---;---;"uncertainty modeling; ontology;";---
2017;21/08/17;Chaturvedi, Ritu and Ezeife, Christie I.;Predicting Student Performance in an ITS Using Task-Driven Features;higher education;20;8;Yes;Yes;No;No;"grades; web logs; duration; difficulty level; success";"resource / assessment data; technical usage data; (learning) behaviour data;";"(learning) output data; (system) environmental data;";---;---;"system; assessment;";"intelligent tutor system;";"automated collection; assessment-based;";"hybrid;";---;---;---;---;"predictive modeling; classification;";---
2017;17/08/17;Zhu, Yanru and Wang, Peng and Fan, Yaqin and Chen, Ying;Research of Learning Path Recommendation Algorithm Based on Knowledge Graph;not specified ;6;6;Yes;Yes;No;No;"cognitive level; learner’s ability to understand knowledge; level of difficulty; learner's test results; reaction time";"resource / assessment data; interaction data;";"cognitive characteristics; (learning) output data; (social) interaction data;";---;---;"system; assessment;";"other;";"assessment-based; automated collection;";"hybrid;";"assessment; third party;";---;"assessment-based; third-party reporting;";"explicit;";---;---
2017;22/07/17;Al-Jadaa, Ali A. and Abu-Issa, Abdallatif S and Ghanem, Wasel T. and Hussein, Mohammed S.;Enhancing the Intelligence of Web Tutoring Systems Using a Multi-Entry Based Open Learner Model;school;14;6;Yes;Yes;No;No;contradictions;"(learning) behaviour data;";"(learning) output data;";---;---;"system; third party; assessment;";"intelligent tutor system;";"assessment-based; third-party reporting; automated collection;";"hybrid;";---;---;---;---;"perturbation modeling; overlay modeling;";---
2017;03/07/17;Ferreira, Hiran Nonato M. and Brant-Ribeiro, Taffarel and Araújo, Rafael D. and Dorça, Fabiano A. and Cattelan, Renan G.;An Automatic and Dynamic Knowledge Assessment Module for Adaptive Educational Systems;higher education;17;9;Yes;Yes;No;No;"personal Information; Behavior; Access context; Progress; Knowledge; learning styles; preferences; disciplin; courses; language; device; location; gamification; colaboration; trace";"demographic & biographic data; personal traits; interaction data; (learning) behaviour data;";"master data; cognitive characteristics; (social) interaction data; (learning) output data;";Personal Information, Behavior, Access context, and Progress/Knowledge;"- ontology
- a Bayesian Network (BN)";"system;

";"adaptive learning system; ubiquitous learning environment;";"automated collection;";"implicit;



";---;---;---;---;"uncertainty modeling; ontology; predictive modeling;";---
2017;03/07/17;Mejia, Carolina and Gomez, Sergio and Mancera, Laura and Taveneau, Sibylle;Inclusive Learner Model for Adaptive Recommendations in Virtual Education;higher education;8;16;Yes;Yes;No;No;"demographic; competences; learning styles; cognitive traits; interaction; cognitive deficits; academic level; occupation; skills; school life; history of learning difficulties; writing habits; phonological processing; orthographic processing; lexical access; processing speed; working memory; semantic processing";"demographic & biographic data; personal traits; interaction data; (learning) behaviour data;";"master data; cognitive characteristics; (social) interaction data; (learning) output data;";"- Demographic
- Competences
- Learning style
- Reading difficulties
- Cognitive traits";---;"system; assessment; self-report;";"learning management system / virtual learning environment;";"assessment-based; automated collection;";"hybrid;";---;---;---;---;"predictive modeling;";---
2017;01/07/17;He, Xiaxu and Liu, Pengfei and Zhang, Weifeng;Design and Implementation of a Unified Mooc Recommendation System for Social Work Major: Experiences and Lessons;higher education;10;15;Yes;No;No;No;"personal assessment feedback information; historical behavior record; users’ preferences";"resource / assessment data; (learning) behaviour data; interaction data; technical usage data; personal traits;";"(learning) output data; (social) interaction data; (system) environmental data; master data;";---;---;---;---;---;---;---;---;---;---;---;---
2017;27/06/17;Huang, Shihua and Yin, Baoyuan and Liu, Ming;Research on Individualized Learner Model Based on Context-Awareness;not specified;18;8;Yes;Yes;No;No;"Real-time  Location; Basic information; Learning style; Cognitive level; Interest preference; device; learning time; learning place; Cognitive Ability; Knowledge State; Learning progress; Learning efficiency";"contextual data; personal traits; (learning) behaviour data; interaction data;";"(system) environmental data; master data; cognitive characteristics; (learning) output data; (social) interaction data;";"- Basic Information
- Learning History
- Knowledge States
- Learning Styles
- Emotional states";---;"system; sensors & wearables;";"ubiquitous learning environment;";"automated collection;";"implicit;



";---;---;---;---;"classification; predictive modeling;";---
2017;27/06/17;Yi, Baolin and Lv, Yuegong and Liu, Hai and Zhang, Zhaoli and Zhang, Dujuan and Wang, Yi;LSCB-ALS: A New ALS and Its Application in Java Language Learning;higher education;11;3;No;Yes;No;No;---;---;---;---;---;---;---;---;---;"self-report; assessment;";---;"self-reporting; assessment-based;";"explicit;";"ontology;";---
2017;27/06/17;Yi, Baolin and Zhang, Dujuan and Wang, Yi and Liu, Hai and Zhang, Zhaoli and Shu, Jiangbo and Lv, Yuegong;Research on Personalized Learning Model under Informatization Environment;not specified;10;12;Yes;Yes;No;No;"learner’s behavior data; learning progress; learner’s cognitive level; learning style; Knowledge";"(learning) behaviour data; interaction data; personal traits;";"(learning) output data; (social) interaction data; cognitive characteristics; master data;";---;---;"system; assessment; self-report;";"personalized learning environment / recommender system;";"automated collection; assessment-based;";"hybrid;";"assessment; self-report; system;";"personalized learning environment / recommender system;";"self-reporting; automated collection;";"hybrid;";"predictive modeling; classification;";---
2017;24/05/17;Kotova, Elena E.;Intellectual data analysis in the educational process;not specified;13;15;Yes;Yes;No;No;"cognitive sphere; individual information";"personal traits; demographic & biographic data; identification data;";"cognitive characteristics; master data;";---;---;---;---;---;---;---;---;---;---;"classification; clustering; predictive modeling;";---
2017;19/05/17;Meenakshi, K. and Sunder, R. and Kumar, Aditya and Sharma, Nitesh;An intelligent smart tutor system based on emotion analysis and recommendation engine;not specified;14;18;Yes;Yes;No;No;"interests; performance; feedback";"personal traits;  resource / assessment data;";"master data; (learning) output data;";---;---;"system; assessment;";"intelligent tutor system;";"automated collection; assessment-based;";"hybrid;";"assessment;";---;"assessment-based;";explicit;"predictive modeling; constraint-based modeling; cognitive theories; perturbation modeling;";---
2017;01/05/17;Maravanyika, Munyaradzi and Dlodlo, Nomusa and Jere, Nobert;An adaptive recommender-system based framework for personalised teaching and learning on e-learning platforms;not specified;28;52;Yes;Yes;No;Yes;"knowledge; learning preferences; learning styles; Cognitive style; Motivation; interests; Skills; capabilities; Bugs model; Demographic data";"personal traits; demographic & biographic data;";"cognitive characteristics; master data; affective & motivational characteristics;";---;---;---;---;---;---;---;---;---;---;---;---
2017;26/04/17;Ouf, Shimaa and Ellatif, Mahmoud Abd and Salama, S. E. and Helmy, Yehia;A proposed paradigm for smart learning environment based on semantic web;not specified;114;154;Yes;Yes;No;Yes;"learners needs; skills; learning history; device; preferences; knowledge; learning style; intellectual levels; personal information; performance; interests; learning goal; credentials; portfolio; relations; preference information; demographic information; biographic information; qualifications; certifications; ambitions; activity; work experience; interest; hobbies activities; competency; abilities; accessibility; academic achievement; goals; certification; learner's events; appointments; basic information; groups; projects; social network; general attributes; affiliation; academic information; management information; relationship information; security information; purposes of education; calendar; time; interaction; cognitive traits; personality; learner's background; behavior; learning process; environment; ecosystem; Identification";"personal traits; (learning) behaviour data; contextual data; demographic & biographic data;  resource / assessment data; identification data; interaction data; academic / educational data; social content data;";"master data; cognitive characteristics; (learning) output data; (system) environmental data; (social) interaction data;";---;---;---;---;---;---;---;---;---;---;---;---
2017;29/03/17;Andaloussi, Kenza Sakout and Capus, Laurence and Berrada, Ismail;Adaptive Educational Hypermedia Systems: Current Developments and Challenges;not specified;70;14;Yes;Yes;No;Yes;"learning style; demographic; psychological state; previous knowledge; interaction with the system";"personal traits; demographic & biographic data; physiological data; interaction data;";"master data; psychomotor & physiological data; cognitive characteristics; (social) interaction data;";---;---;---;---;---;---;---;---;---;---;---;---
2017;25/03/17;Zhao, Jichun and Chen, Lei and Guo, Jianxin;Research and construction of personalized user interest model for distance learning;not specified;11;2;Yes;No;No;No;"user attribute information; learning behavior; profession; interests; learning record; learning plan; occupation; preference";"demographic & biographic data; (learning) behaviour data; interaction data; academic / educational data; personal traits;";"master data; (learning) output data; (social) interaction data;";---;- Ontology;---;---;---;---;---;---;---;---;---;---
2017;13/03/17;Hansen, Cecilie Johanne Slokvik and Wasson, Barbara and Skretting, Hans and Netteland, Grete and Hirnstein, Marina;When Learning is High Stake;adult learning;7;3;No;Yes;Yes;No;---;---;---;---;---;"assessment;";---;"assessment-based;";"explicit;";---;---;---;---;"overlay modeling; classification; predictive modeling;";care about the renewal of certifications, so there is some sense of forgetting
2017;07/03/17;Barria-Pineda, Jordan and Guerra, Julio and Huang, Yun and Brusilovsky, Peter;Concept-Level Knowledge Visualization For Supporting Self-Regulated Learning;higher education;5;16;Yes;Yes;No;No;knowledge;---;"cognitive characteristics;";---;---;"system; assessment;";"other;";"automated collection; assessment-based;";"hybrid;";"system; assessment;";"other;";"automated collection;";"implicit;";"uncertainty modeling; predictive modeling;";---
2016;05/12/16;Bent, Oliver and Dey, Prasenjit and Weldemariam, Komminist and Mohania, Mukesh K.;Modeling user behavior data in systems of engagement;not specified;32;16;Yes;Yes;No;No;"interaction events; sensor; learner opinion; engagement; learning styles; learning preferences; ACCELEROMETER; MICROPHONE; LIGHT SENSOR; GPS; learners context";"interaction data; personal traits; physiological data; contextual data;";"(social) interaction data; affective & motivational characteristics; master data; psychomotor & physiological data; (system) environmental data;";---;---;"sensors & wearables;  system; observation source;";"collaborative learning environment; mobile system;";"automated collection; observation;";"implicit;



";---;---;---;---;"predictive modeling;";---
2016;01/12/16;Zhu, Yan and Liu, Song and Guo, Han and Jin, Shuaijun;Design of Adaptive Electrician Learning System Based on User Model;vocational/professional training;5;1;Yes;Yes;No;No;"knowledge; preferences; interest; basic information; learning style; cognitive level; learning process; learning behavior; learning history; media types; learning time; access times; education level; occupation; Background; proficiency; cognitive ability; understanding; preference resource; Learning path; browsing time";"personal traits; (learning) behaviour data; interaction data; technical usage data; academic / educational data; demographic & biographic data;";"cognitive characteristics; master data; (learning) output data; (social) interaction data; (system) environmental data;";---;---;"system; assessment;";"adaptive learning system;";"assessment-based; automated collection;";"hybrid;";"self-report;";---;"self-reporting;";explicit;"ontology;";---
2016;22/11/16;Ripin, Faizal Hazri Mat and Mokhtar, Rahmah and Zain, Wahidah Mohd;Adaptive Tutoring System User Preferences: Does Gender Matter?;higher education;21;0;Yes;Yes;No;Yes;gender;"demographic & biographic data;";"master data;";---;---;---;---;---;---;---;---;---;---;---;---
